{
  "feedbackLevel": "none",
  "rootNode": 0,
  "nodes": {
    "0": {
      "layouts": {
        "desktop": [
          {
            "id": 0,
            "x": 20,
            "y": 20,
            "width": 5,
            "height": 5
          }
        ],
        "phone": [
          {
            "id": 0,
            "x": 20,
            "y": 20,
            "width": 2,
            "height": 2
          }
        ],
        "tablet": [
          {
            "id": 0,
            "x": 20,
            "y": 20,
            "width": 2,
            "height": 2
          }
        ]
      },
      "components": {
        "0": {
          "component": {},
          "dependencies": {
            "dotDescription": "$.taskData.dotDescription"
          },
          "isCorrect": true,
          "isValid": true,
          "name": "Beispielgraph",
          "type": "DOTGraph"
        }
      }
    }
  },
  "edges": {
    "0": [1]
  },
  "layoutSize": "desktop",
  "taskData": {
    "dotDescription": "digraph G { bgcolor=transparent  a->b; b->c; c->a; }"
  }
}
